CREATE TABLE aqo_test0(a int, b int, c int, d int);
WITH RECURSIVE t(a, b, c, d)
AS (
   VALUES (0, 0, 0, 0)
   UNION ALL
   SELECT t.a + 1, t.b + 1, t.c + 1, t.d + 1 FROM t WHERE t.a < 2000
) INSERT INTO aqo_test0 (SELECT * FROM t);
CREATE INDEX aqo_test0_idx_a ON aqo_test0 (a);
ANALYZE aqo_test0;
CREATE TABLE aqo_test1(a int, b int);
WITH RECURSIVE t(a, b)
AS (
   VALUES (1, 2)
   UNION ALL
   SELECT t.a + 1, t.b + 1 FROM t WHERE t.a < 20
) INSERT INTO aqo_test1 (SELECT * FROM t);
CREATE INDEX aqo_test1_idx_a ON aqo_test1 (a);
ANALYZE aqo_test1;
CREATE TABLE aqo_test2(a int);
WITH RECURSIVE t(a)
AS (
   VALUES (0)
   UNION ALL
   SELECT t.a + 1 FROM t WHERE t.a < 100000
) INSERT INTO aqo_test2 (SELECT * FROM t);
CREATE INDEX aqo_test2_idx_a ON aqo_test2 (a);
ANALYZE aqo_test2;
CREATE EXTENSION aqo;
SET aqo.mode = 'controlled';
EXPLAIN (COSTS FALSE)
SELECT * FROM aqo_test0
WHERE a < 3 AND b < 3 AND c < 3 AND d < 3;
                  QUERY PLAN                   
-----------------------------------------------
 Index Scan using aqo_test0_idx_a on aqo_test0
   Index Cond: (a < 3)
   Filter: ((b < 3) AND (c < 3) AND (d < 3))
(3 rows)

EXPLAIN (COSTS FALSE)
SELECT * FROM aqo_test0
WHERE a < 5 AND b < 5 AND c < 5 AND d < 5;
                  QUERY PLAN                   
-----------------------------------------------
 Index Scan using aqo_test0_idx_a on aqo_test0
   Index Cond: (a < 5)
   Filter: ((b < 5) AND (c < 5) AND (d < 5))
(3 rows)

SET aqo.mode = 'intelligent';
CREATE TABLE tmp1 AS SELECT * FROM aqo_test0
WHERE a < 3 AND b < 3 AND c < 3 AND d < 3;
SELECT count(*) FROM tmp1;
 count 
-------
     3
(1 row)

DROP TABLE tmp1;
CREATE TABLE tmp1 AS SELECT * FROM aqo_test0
WHERE a < 5 AND b < 5 AND c < 5 AND d < 5;
SELECT count(*) FROM tmp1;
 count 
-------
     5
(1 row)

DROP TABLE tmp1;
CREATE TABLE tmp1 AS SELECT t1.a, t2.b FROM aqo_test0 AS t1, aqo_test0 AS t2
WHERE t1.a < 1 AND t1.b < 1 AND t2.c < 1 AND t2.d < 1;
SELECT count(*) FROM tmp1;
 count 
-------
     1
(1 row)

DROP TABLE tmp1;
CREATE TABLE tmp1 AS SELECT t1.a, t2.b, t3.c
FROM aqo_test1 AS t1, aqo_test0 AS t2, aqo_test0 AS t3
WHERE t1.a < 1 AND t3.b < 1 AND t2.c < 1 AND t3.d < 0 AND t1.a = t2.a AND t1.b = t3.b;
SELECT count(*) FROM tmp1;
 count 
-------
     0
(1 row)

DROP TABLE tmp1;
CREATE TABLE tmp1 AS SELECT t1.a AS a, t2.a AS b, t3.a AS c
FROM aqo_test1 AS t1, aqo_test1 AS t2, aqo_test1 AS t3
WHERE t1.a = t2.b AND t2.a = t3.b;
SELECT count(*) FROM tmp1;
 count 
-------
    18
(1 row)

DROP TABLE tmp1;
CREATE TABLE tmp1 AS SELECT t1.a AS a, t2.a AS b, t3.a AS c, t4.a AS d
FROM aqo_test1 AS t1, aqo_test1 AS t2, aqo_test1 AS t3, aqo_test1 AS t4
WHERE t1.a = t2.b AND t2.a = t3.b AND t3.a = t4.b;
SELECT count(*) FROM tmp1;
 count 
-------
    17
(1 row)

DROP TABLE tmp1;
SET aqo.mode = 'controlled';
UPDATE aqo_queries SET auto_tuning=false;
UPDATE aqo_queries SET learn_aqo=true;
UPDATE aqo_queries SET use_aqo=false;
EXPLAIN (COSTS FALSE)
SELECT * FROM aqo_test0
WHERE a < 3 AND b < 3 AND c < 3 AND d < 3;
                  QUERY PLAN                   
-----------------------------------------------
 Index Scan using aqo_test0_idx_a on aqo_test0
   Index Cond: (a < 3)
   Filter: ((b < 3) AND (c < 3) AND (d < 3))
(3 rows)

EXPLAIN (COSTS FALSE)
SELECT * FROM aqo_test0
WHERE a < 5 AND b < 5 AND c < 5 AND d < 5;
                  QUERY PLAN                   
-----------------------------------------------
 Index Scan using aqo_test0_idx_a on aqo_test0
   Index Cond: (a < 5)
   Filter: ((b < 5) AND (c < 5) AND (d < 5))
(3 rows)

EXPLAIN (COSTS FALSE)
SELECT t1.a, t2.b FROM aqo_test0 AS t1, aqo_test0 AS t2
WHERE t1.a < 1 AND t1.b < 1 AND t2.c < 1 AND t2.d < 1;
                       QUERY PLAN                       
--------------------------------------------------------
 Nested Loop
   ->  Index Scan using aqo_test0_idx_a on aqo_test0 t1
         Index Cond: (a < 1)
         Filter: (b < 1)
   ->  Seq Scan on aqo_test0 t2
         Filter: ((c < 1) AND (d < 1))
(6 rows)

EXPLAIN (COSTS FALSE)
SELECT t1.a, t2.b FROM aqo_test1 AS t1, aqo_test0 AS t2
WHERE t1.a < 1 AND t2.b < 1 AND t2.c < 1 AND t2.d < 1 AND t1.a = t2.a;
                       QUERY PLAN                       
--------------------------------------------------------
 Nested Loop
   ->  Seq Scan on aqo_test1 t1
         Filter: (a < 1)
   ->  Index Scan using aqo_test0_idx_a on aqo_test0 t2
         Index Cond: (a = t1.a)
         Filter: ((b < 1) AND (c < 1) AND (d < 1))
(6 rows)

EXPLAIN (COSTS FALSE)
SELECT t1.a, t2.b, t3.c
FROM aqo_test1 AS t1, aqo_test0 AS t2, aqo_test0 AS t3
WHERE t1.a < 1 AND t3.b < 1 AND t2.c < 1 AND t3.d < 0 AND t1.a = t2.a AND t1.b = t3.b;
                          QUERY PLAN                          
--------------------------------------------------------------
 Nested Loop
   Join Filter: (t1.b = t3.b)
   ->  Nested Loop
         ->  Seq Scan on aqo_test1 t1
               Filter: (a < 1)
         ->  Index Scan using aqo_test0_idx_a on aqo_test0 t2
               Index Cond: (a = t1.a)
               Filter: (c < 1)
   ->  Seq Scan on aqo_test0 t3
         Filter: ((b < 1) AND (d < 0))
(10 rows)

EXPLAIN (COSTS FALSE)
SELECT t1.a AS a, t2.a AS b, t3.a AS c
FROM aqo_test1 AS t1, aqo_test1 AS t2, aqo_test1 AS t3
WHERE t1.a = t2.b AND t2.a = t3.b;
                 QUERY PLAN                 
--------------------------------------------
 Hash Join
   Hash Cond: (t2.a = t3.b)
   ->  Hash Join
         Hash Cond: (t1.a = t2.b)
         ->  Seq Scan on aqo_test1 t1
         ->  Hash
               ->  Seq Scan on aqo_test1 t2
   ->  Hash
         ->  Seq Scan on aqo_test1 t3
(9 rows)

UPDATE aqo_queries SET use_aqo=true;
EXPLAIN (COSTS FALSE)
SELECT * FROM aqo_test0
WHERE a < 3 AND b < 3 AND c < 3 AND d < 3;
                  QUERY PLAN                   
-----------------------------------------------
 Index Scan using aqo_test0_idx_a on aqo_test0
   Index Cond: (a < 3)
   Filter: ((b < 3) AND (c < 3) AND (d < 3))
(3 rows)

EXPLAIN (COSTS FALSE)
SELECT * FROM aqo_test0
WHERE a < 5 AND b < 5 AND c < 5 AND d < 5;
                  QUERY PLAN                   
-----------------------------------------------
 Index Scan using aqo_test0_idx_a on aqo_test0
   Index Cond: (a < 5)
   Filter: ((b < 5) AND (c < 5) AND (d < 5))
(3 rows)

EXPLAIN (COSTS FALSE)
SELECT t1.a, t2.b FROM aqo_test0 AS t1, aqo_test0 AS t2
WHERE t1.a < 1 AND t1.b < 1 AND t2.c < 1 AND t2.d < 1;
                       QUERY PLAN                       
--------------------------------------------------------
 Nested Loop
   ->  Index Scan using aqo_test0_idx_a on aqo_test0 t1
         Index Cond: (a < 1)
         Filter: (b < 1)
   ->  Seq Scan on aqo_test0 t2
         Filter: ((c < 1) AND (d < 1))
(6 rows)

EXPLAIN (COSTS FALSE)
SELECT t1.a, t2.b FROM aqo_test1 AS t1, aqo_test0 AS t2
WHERE t1.a < 1 AND t2.b < 1 AND t2.c < 1 AND t2.d < 1 AND t1.a = t2.a;
                       QUERY PLAN                       
--------------------------------------------------------
 Nested Loop
   ->  Seq Scan on aqo_test1 t1
         Filter: (a < 1)
   ->  Index Scan using aqo_test0_idx_a on aqo_test0 t2
         Index Cond: (a = t1.a)
         Filter: ((b < 1) AND (c < 1) AND (d < 1))
(6 rows)

EXPLAIN (COSTS FALSE)
SELECT t1.a, t2.b, t3.c
FROM aqo_test1 AS t1, aqo_test0 AS t2, aqo_test0 AS t3
WHERE t1.a < 1 AND t3.b < 1 AND t2.c < 1 AND t3.d < 0 AND t1.a = t2.a AND t1.b = t3.b;
                          QUERY PLAN                          
--------------------------------------------------------------
 Nested Loop
   Join Filter: (t1.b = t3.b)
   ->  Nested Loop
         ->  Seq Scan on aqo_test1 t1
               Filter: (a < 1)
         ->  Index Scan using aqo_test0_idx_a on aqo_test0 t2
               Index Cond: (a = t1.a)
               Filter: (c < 1)
   ->  Seq Scan on aqo_test0 t3
         Filter: ((b < 1) AND (d < 0))
(10 rows)

EXPLAIN (COSTS FALSE)
SELECT t1.a AS a, t2.a AS b, t3.a AS c
FROM aqo_test1 AS t1, aqo_test1 AS t2, aqo_test1 AS t3
WHERE t1.a = t2.b AND t2.a = t3.b;
                 QUERY PLAN                 
--------------------------------------------
 Hash Join
   Hash Cond: (t2.a = t3.b)
   ->  Hash Join
         Hash Cond: (t1.a = t2.b)
         ->  Seq Scan on aqo_test1 t1
         ->  Hash
               ->  Seq Scan on aqo_test1 t2
   ->  Hash
         ->  Seq Scan on aqo_test1 t3
(9 rows)

EXPLAIN (COSTS FALSE)
SELECT t1.a AS a, t2.a AS b, t3.a AS c
FROM aqo_test2 AS t1, aqo_test1 AS t2, aqo_test1 AS t3
WHERE t1.a = t2.b AND t2.a = t3.b;
                               QUERY PLAN                                
-------------------------------------------------------------------------
 Hash Join
   Hash Cond: (t3.b = t2.a)
   ->  Seq Scan on aqo_test1 t3
   ->  Hash
         ->  Merge Join
               Merge Cond: (t1.a = t2.b)
               ->  Index Only Scan using aqo_test2_idx_a on aqo_test2 t1
               ->  Sort
                     Sort Key: t2.b
                     ->  Seq Scan on aqo_test1 t2
(10 rows)

DROP INDEX aqo_test0_idx_a;
DROP TABLE aqo_test0;
DROP INDEX aqo_test1_idx_a;
DROP TABLE aqo_test1;
DROP INDEX aqo_test2_idx_a;
DROP TABLE aqo_test2;
DROP EXTENSION aqo;
